MCQ,Choices,Correct
Who coined the term machine learning in 1959?,a: Donald Hebb|b: Walter Pitts|c: Arthur Samuel|d: Warren McCulloch,c
What was the earliest machine learning model introduced by Arthur Samuel?,a: Program for calculating winning chance in chess|b: Program for calculating winning chance in checkers|c: Program for calculating winning chance in tic-tac-toe|d: Program for calculating winning chance in poker,b
Who proposed the early mathematical models of neural networks for machine learning algorithms?,a: Donald Hebb|b: Walter Pitts|c: Arthur Samuel|d: Warren McCulloch,b
What did the experimental 'learning machine' called Cybertron developed by Raytheon Company analyze using rudimentary reinforcement learning?,a: Weather patterns|b: Sonar signals|c: Traffic patterns|d: Social media data,b
"According to Tom M. Mitchell, what is the definition of a computer program learning from experience in machine learning?",a: Improving performance at tasks with respect to some class of tasks|b: Improving performance at tasks with respect to some class of tasks without experience|c: Not improving performance at tasks with respect to some class of tasks|d: Improving performance at tasks with respect to some class of tasks with experience,a
